id,name,releasedate,duration,directorid,producerid,writerid,imdb,budget,collection,certification,score
tt0906108,"Why Did I Get Married?","12 October 2007 ","1h 53min",/name/nm1347153?ref_=tt_ov_dr,/company/co0060306?ref_=cons_tt_dt_co_1,/name/nm1347153?ref_=tt_ov_wr,5.7,"$15,000,000","$21,353,759","Rated PG-13 for mature thematic material, sexual references and language",0.0000
tt0918927,Doubt,"25 December 2008 ","1h 44min",/name/nm0788234?ref_=tt_ov_dr,/company/co0258162?ref_=cons_tt_dt_co_1,/name/nm0788234?ref_=tt_ov_wr,7.5,"$20,000,000","$507,226","Rated PG-13 for thematic material",0.0000
tt0918940,"The Legend of Tarzan","1 July 2016 ","1h 50min",/name/nm0946734?ref_=tt_ov_dr,/company/co0108864?ref_=cons_tt_dt_co_1,/name/nm3092414?ref_=tt_ov_wr,6.3,"$180,000,000","$38,527,856","Rated PG-13 for sequences of action and violence, some sensuality and brief rude dialogue",0.0000
tt0926084,"Harry Potter and the Deathly Hallows: Part 1","19 November 2010 ","2h 26min",/name/nm0946734?ref_=tt_ov_dr,/company/co0026840?ref_=cons_tt_dt_co_1,/name/nm0460141?ref_=tt_ov_wr,7.7,"$125,017,327,","$295,983,30","Rated PG-13 for some sequences of intense action violence, frightening images and brief sensuality",0.0000
tt0926129,"Prom Night","25 July 2008 ","1h 28min",/name/nm1879589?ref_=tt_ov_dr,/company/co0005584?ref_=cons_tt_dt_co_1,/name/nm0136592?ref_=tt_ov_wr,3.9,"$20,000,000","$20,804,941","Rated PG-13 for violence and terror, some sexual material, underage drinking, and language",0.0000
tt0937375,"This Christmas","21 November 2007 ","1h 57min",/name/nm0926211?ref_=tt_ov_dr,/company/co0156146?ref_=cons_tt_dt_co_1,/name/nm0926211?ref_=tt_ov_wr,6.2,"$13,000,000","$17,958,183","Rated PG-13 for comic sexual content and some violence",0.0000
tt0938283,"The Last Airbender","9 July 2010 ","1h 43min",/name/nm0796117?ref_=tt_ov_dr,/company/co0023400?ref_=cons_tt_dt_co_1,/name/nm0796117?ref_=tt_ov_wr,4.2,"$150,000,000","$51,804,232","Rated PG for fantasy action violence",0.0000
tt0944835,Salt,"23 July 2010 ","1h 40min",/name/nm0637518?ref_=tt_ov_dr,/company/co0071509?ref_=cons_tt_dt_co_1,/name/nm0934483?ref_=tt_ov_wr,6.4,"$110,000,000","$36,011,243","Rated PG-13 for intense sequences of violence and action",0.0000
tt0945513,"Source Code","1 May 2011 ","1h 33min",/name/nm1512910?ref_=tt_ov_dr,/company/co0046206?ref_=cons_tt_dt_co_1,/name/nm1618286?ref_=tt_ov_wr,7.5,"$32,000,000","$14,812,094","Rated PG-13 for some violence including disturbing images, and for language",0.0000
tt0947798,"Black Swan","25 February 2011 ","1h 48min",/name/nm0004716?ref_=tt_ov_dr,/company/co0028932?ref_=cons_tt_dt_co_1,/name/nm2114730?ref_=tt_ov_wr,8.0,"$13,000,000","$1,443,809","Rated R for strong sexual content, disturbing violent images, language and some drug use",0.0000
tt0947810,"Green Zone","12 March 2010 ","1h 55min",/name/nm0339030?ref_=tt_ov_dr,/company/co0005073?ref_=cons_tt_dt_co_1,/name/nm0001338?ref_=tt_ov_wr,6.8,"$100,000,000","$14,309,295","Rated R for violence and language",0.0000
tt0948470,"The Amazing Spider-Man","29 June 2012 ","2h 16min",/name/nm1989536?ref_=tt_ov_dr,/company/co0071509?ref_=cons_tt_dt_co_1,/name/nm0888743?ref_=tt_ov_wr,7.0,"$230,000,000","$62,004,688",UA,0.0000
tt0952640,"Alvin and the Chipmunks","14 December 2007 ","1h 32min",/name/nm0384722?ref_=tt_ov_dr,/company/co0017497?ref_=cons_tt_dt_co_1,/name/nm0900140?ref_=tt_ov_wr,5.2,"$60,000,000","$44,307,417","Rated PG for some mild rude humor",0.0000
tt0956038,"Nights in Rodanthe","26 September 2008 ","1h 37min",/name/nm0938045?ref_=tt_ov_dr,/company/co0026840?ref_=cons_tt_dt_co_1,/name/nm0668754?ref_=tt_ov_wr,6.0,"$30,000,000","$13,418,454","Rated PG-13 for some sensuality",0.0000
tt0964517,"The Fighter","17 December 2010 ","1h 56min",/name/nm0751102?ref_=tt_ov_dr,/company/co0198598?ref_=cons_tt_dt_co_1,/name/nm0798788?ref_=tt_ov_wr,7.8,"$25,000,000","$300,010","Rated R for language throughout, drug content, some violence and sexuality",0.0000
tt0970179,Hugo,"4 May 2012 ","2h 6min",/name/nm0000217?ref_=tt_ov_dr,/company/co0023400?ref_=cons_tt_dt_co_1,/name/nm0517589?ref_=tt_ov_wr,7.5,"$150,000,000","$11,364,505",U,0.0000
tt0970866,"Little Fockers","4 February 2011 ","1h 38min",/name/nm0919369?ref_=tt_ov_dr,/company/co0005073?ref_=cons_tt_dt_co_1,/name/nm0357453?ref_=tt_ov_wr,5.5,"$100,000,000","$30,833,665","Rated PG-13 for mature sexual humor throughout, language and some drug content",0.0000
tt0974015,"Justice League","17 November 2017 ",2h,/name/nm0811583?ref_=tt_ov_dr,/company/co0028338?ref_=cons_tt_dt_co_1,/name/nm0006516?ref_=tt_ov_wr,6.8,"$300,000,000","$93,842,239",UA,0.0000
tt0974661,"17 Again","17 April 2009 ","1h 42min",/name/nm0824882?ref_=tt_ov_dr,/company/co0046718?ref_=cons_tt_dt_co_1,/name/nm0276821?ref_=tt_ov_wr,6.4,"$20,000,000","$23,722,310","Rated PG-13 for language, some sexual material and teen partying",0.0000
tt0976051,"The Reader","30 January 2009 ","2h 4min",/name/nm0197636?ref_=tt_ov_dr,/company/co0150452?ref_=cons_tt_dt_co_1,/name/nm0002376?ref_=tt_ov_wr,7.6,"$32,000,000","$168,051","Rated R for some scenes of sexuality and nudity",0.0000
tt0980970,"The Chronicles of Narnia: The Voyage of the Dawn Treader","3 December 2010 ","1h 53min",/name/nm0000776?ref_=tt_ov_dr,/company/co0017497?ref_=cons_tt_dt_co_1,/name/nm1321655?ref_=tt_ov_wr,6.3,"$155,000,000","$24,005,069","Rated PG for some frightening images and sequences of fantasy action",0.0000
tt0985694,Machete,"3 September 2010 ","1h 45min",/name/nm0542450?ref_=tt_ov_dr,/company/co0239634?ref_=cons_tt_dt_co_1,/name/nm0001675?ref_=tt_ov_wr,6.6,"$10,500,000","$14,102,888","Rated R for strong bloody violence throughout, language, some sexual content and nudity",0.0000
tt0990407,"The Green Hornet","14 January 2011 ","1h 59min",/name/nm0327273?ref_=tt_ov_dr,/company/co0071509?ref_=cons_tt_dt_co_1,/name/nm0736622?ref_=tt_ov_wr,5.8,"$120,000,000","$33,526,876","Rated PG-13 for sequences of violent action, language, sensuality and drug content",0.0000
tt0993842,Hanna,"3 June 2011 ","1h 51min",/name/nm0942504?ref_=tt_ov_dr,/company/co0042399?ref_=cons_tt_dt_co_1,/name/nm2605946?ref_=tt_ov_wr,6.8,"$30,000,000","$12,370,549","Rated PG-13 for intense sequences of violence and action, some sexual material and language",0.0000
tt0993846,"The Wolf of Wall Street","3 January 2014 ",3h,/name/nm0000217?ref_=tt_ov_dr,/company/co0325207?ref_=cons_tt_dt_co_1,/name/nm1010540?ref_=tt_ov_wr,8.2,"$100,000,000","$18,361,578",A,0.0000
tt1001526,Megamind,"24 December 2010 ","1h 35min",/name/nm0569891?ref_=tt_ov_dr,/company/co0129164?ref_=cons_tt_dt_co_1,/name/nm0774786?ref_=tt_ov_wr,7.3,"$130,000,000","$46,016,833","Rated PG for action and some language",0.0000
tt1013743,"Knight and Day","9 July 2010 ","1h 49min",/name/nm0003506?ref_=tt_ov_dr,/company/co0000756?ref_=cons_tt_dt_co_1,/name/nm0642277?ref_=tt_ov_wr,6.3,"$117,000,000","$20,139,985","Rated PG-13 for sequences of action violence throughout, and brief strong language",0.0000
tt1013753,Milk,"20 February 2009 ","2h 8min",/name/nm0001814?ref_=tt_ov_dr,/company/co0042399?ref_=cons_tt_dt_co_1,/name/nm0085257?ref_=tt_ov_wr,7.6,"$20,000,000","$1,453,844","Rated R for language, some sexual content and brief violence",0.0000
tt1018785,"The Sisterhood of the Traveling Pants 2","6 August 2008 ","1h 59min",/name/nm1065402?ref_=tt_ov_dr,/company/co0054452?ref_=cons_tt_dt_co_1,/name/nm0151358?ref_=tt_ov_wr,6.2,"$10,678,430,","$44,087,387","Rated PG-13 for mature material and sensuality",0.0000
tt1023481,"Step Up 2: The Streets","14 February 2008 ","1h 38min",/name/nm0160840?ref_=tt_ov_dr,/company/co0049348?ref_=cons_tt_dt_co_1,/name/nm0426355?ref_=tt_ov_wr,6.3,"$17,500,000","$22,125,429","Rated PG-13 for language, some suggestive material and brief violence",0.0000
tt1027718,"Wall Street: Money Never Sleeps","24 September 2010 ","2h 13min",/name/nm0000231?ref_=tt_ov_dr,/company/co0000756?ref_=cons_tt_dt_co_1,/name/nm1615610?ref_=tt_ov_wr,6.2,"$70,000,000","$19,011,188","Rated PG-13 for brief strong language and thematic elements",0.0000
tt1028576,Secretariat,"8 October 2010 ","2h 3min",/name/nm0908824?ref_=tt_ov_dr,/company/co0008970?ref_=cons_tt_dt_co_1,/name/nm0723692?ref_=tt_ov_wr,7.2,"$35,000,000","$12,694,770","Rated PG for brief mild language",0.0000
tt1033575,"The Descendants","26 January 2012 ","1h 55min",/name/nm0668247?ref_=tt_ov_dr,/company/co0028932?ref_=cons_tt_dt_co_1,/name/nm0668247?ref_=tt_ov_wr,7.3,"$20,000,000","$1,190,096",A,0.0000
tt1034331,"Righteous Kill","12 September 2008 ","1h 41min",/name/nm0000816?ref_=tt_ov_dr,/company/co0002572?ref_=cons_tt_dt_co_1,/name/nm1897957?ref_=tt_ov_wr,6.0,"$60,000,000","$16,288,361","Rated R for violence, pervasive language, some sexuality and brief drug use",0.0000
tt1037705,"The Book of Eli","19 March 2010 ","1h 58min",/name/nm0400436?ref_=tt_ov_dr,/company/co0054452?ref_=cons_tt_dt_co_1,/name/nm1729428?ref_=tt_ov_wr,6.9,"$80,000,000","$38,437,553","Rated R for some brutal violence and language",0.0000
tt1038919,"The Bounty Hunter","23 April 2010 ","1h 50min",/name/nm0855035?ref_=tt_ov_dr,/company/co0071509?ref_=cons_tt_dt_co_1,/name/nm0861638?ref_=tt_ov_wr,5.5,"$40,000,000","$20,686,423","Rated PG-13 for sexual content including suggestive comments, language and some violence",0.0000
tt1041829,"The Proposal","19 June 2009 ","1h 48min",/name/nm0281945?ref_=tt_ov_dr,/company/co0049348?ref_=cons_tt_dt_co_1,/name/nm1095804?ref_=tt_ov_wr,6.7,"$40,000,000","$33,627,598","Rated PG-13 for sexual content, nudity and language",0.0000
tt1046173,"G.I. Joe: The Rise of Cobra","21 August 2009 ","1h 58min",/name/nm0814085?ref_=tt_ov_dr,/company/co0023400?ref_=cons_tt_dt_co_1,/name/nm0064181?ref_=tt_ov_wr,5.8,"$175,000,000","$54,713,046","Rated PG-13 for strong sequences of action violence and mayhem throughout",0.0000
tt1049413,Up,"11 September 2009 ","1h 36min",/name/nm0230032?ref_=tt_ov_dr,/company/co0017902?ref_=cons_tt_dt_co_1,/name/nm0230032?ref_=tt_ov_wr,8.3,"$175,000,000","$68,108,790","Rated PG for some peril and action",0.0000
tt1051904,Goosebumps,"30 October 2015 ","1h 43min",/name/nm1224299?ref_=tt_ov_dr,/company/co0071509?ref_=cons_tt_dt_co_1,/name/nm0501359?ref_=tt_ov_wr,6.3,"$58,000,000","$23,618,556","Rated PG for scary and intense creature action and images, and for some rude humor",0.0000
tt1067106,"A Christmas Carol","6 November 2009 ","1h 36min",/name/nm0000709?ref_=tt_ov_dr,/company/co0008970?ref_=cons_tt_dt_co_1,/name/nm0000709?ref_=tt_ov_wr,6.8,"$200,000,000","$30,051,075","Rated PG for scary sequences and images",0.0000
tt1067583,"Water for Elephants","22 April 2011 ",2h,/name/nm1349376?ref_=tt_ov_dr,/company/co0017497?ref_=cons_tt_dt_co_1,/name/nm0481418?ref_=tt_ov_wr,6.9,"$38,000,000","$16,842,353","Rated PG-13 for moments of intense violence and sexual content",0.0000
tt1071875,"Ghost Rider: Spirit of Vengeance","17 February 2012 ","1h 36min",/name/nm0004410?ref_=tt_ov_dr,/company/co0071509?ref_=cons_tt_dt_co_1,/name/nm0991355?ref_=tt_ov_wr,4.3,"$57,000,000","$22,115,334",A,0.0000
tt1073498,"Meet the Spartans","25 January 2008 ","1h 26min",/name/nm0294997?ref_=tt_ov_dr,/company/co0025101?ref_=cons_tt_dt_co_1,/name/nm0294997?ref_=tt_ov_wr,2.7,"$30,000,000","$18,505,530","Rated PG-13 for crude and sexual content throughout, language and some comic violence",0.0000
tt1074638,Skyfall,"26 October 2012 ","2h 23min",/name/nm0005222?ref_=tt_ov_dr,/company/co0054040?ref_=cons_tt_dt_co_1,/name/nm0701031?ref_=tt_ov_wr,7.8,"$200,000,000","$88,364,714",UA,0.0000
tt1078912,"Night at the Museum: Battle of the Smithsonian","24 July 2009 ","1h 45min",/name/nm0506613?ref_=tt_ov_dr,/company/co0000756?ref_=cons_tt_dt_co_1,/name/nm0304830?ref_=tt_ov_wr,5.9,"$150,000,000","$70,052,004","Rated PG for mild action and brief language",0.0000
tt1078940,"Couples Retreat","9 October 2009 ","1h 53min",/name/nm0082526?ref_=tt_ov_dr,/company/co0005073?ref_=cons_tt_dt_co_1,/name/nm0269463?ref_=tt_ov_wr,5.5,"$60,000,000","$34,286,740","Rated PG-13 on appeal for sexual content and language",0.0000
tt1080016,"Ice Age: Dawn of the Dinosaurs","3 July 2009 ","1h 34min",/name/nm0757858?ref_=tt_ov_dr,/company/co0179259?ref_=cons_tt_dt_co_1,/name/nm0010004?ref_=tt_ov_wr,7.0,"$90,000,000","$41,690,382","Rated PG for some mild rude humor and peril",0.0000
tt1082868,Quarantine,"10 October 2008 ","1h 29min",/name/nm0235719?ref_=tt_ov_dr,/company/co0010568?ref_=cons_tt_dt_co_1,/name/nm0235719?ref_=tt_ov_wr,6.0,"$12,000,000","$14,211,321","Rated R for bloody violent and disturbing content, terror and language",0.0000
tt1086772,Blended,"30 May 2014 ","1h 57min",/name/nm0178997?ref_=tt_ov_dr,/company/co0391448?ref_=cons_tt_dt_co_1,/name/nm0578771?ref_=tt_ov_wr,6.5,"$40,000,000","$18,185,000",UA,0.0000
tt1091191,"Lone Survivor","7 February 2014 ","2h 1min",/name/nm0000916?ref_=tt_ov_dr,/company/co0152188?ref_=cons_tt_dt_co_1,/name/nm0000916?ref_=tt_ov_wr,7.5,"$40,000,000","$84,857",A,0.0000
tt1103153,Killers,"4 June 2010 ","1h 40min",/name/nm0525659?ref_=tt_ov_dr,/company/co0173285?ref_=cons_tt_dt_co_1,/name/nm0220521?ref_=tt_ov_wr,5.4,"$75,000,000","$15,837,266","Rated PG-13 for violent action, sexual material and language",0.0000
tt1104001,Tron,"17 December 2010 ","2h 5min",/name/nm2676052?ref_=tt_ov_dr,/company/co0008970?ref_=cons_tt_dt_co_1,/name/nm0457736?ref_=tt_ov_wr,6.8,"$170,000,000","$44,026,211","Rated PG for sequences of sci-fi action violence and brief mild language",0.0000
tt1109624,Paddington,"28 November 2014 ","1h 35min",/name/nm1653753?ref_=tt_ov_dr,/company/co0047476?ref_=cons_tt_dt_co_1,/name/nm1653753?ref_=tt_ov_wr,7.2,"$55,000,000","$25,205,000","Rated PG for mild action and rude humor",0.0000
tt1111422,"The Taking of Pelham 123","12 June 2009 ","1h 46min",/name/nm0001716?ref_=tt_ov_dr,/company/co0071509?ref_=cons_tt_dt_co_1,/name/nm0001338?ref_=tt_ov_wr,6.4,"$100,000,000","$23,373,102",A,0.0000
tt1119646,"The Hangover","26 June 2009 ","1h 40min",/name/nm0680846?ref_=tt_ov_dr,/company/co0026840?ref_=cons_tt_dt_co_1,/name/nm0524190?ref_=tt_ov_wr,7.7,"$35,000,000","$44,979,319",A,0.0000
tt1124035,"The Ides of March","18 November 2011 ","1h 41min",/name/nm0000123?ref_=tt_ov_dr,/company/co0071509?ref_=cons_tt_dt_co_1,/name/nm0000123?ref_=tt_ov_wr,7.1,"$12,500,000","$10,470,143",A,0.0000
tt1126618,"Morning Glory","10 November 2010 ","1h 47min",/name/nm0585011?ref_=tt_ov_dr,/company/co0021593?ref_=cons_tt_dt_co_1,/name/nm0112459?ref_=tt_ov_wr,6.5,"$40,000,000","$9,203,266","Rated PG-13 for some sexual content including dialogue, language and brief drug references",0.0000
tt1129423,Fireproof,"26 September 2008 ","2h 2min",/name/nm1731937?ref_=tt_ov_dr,/company/co0058013?ref_=cons_tt_dt_co_1,/name/nm1731937?ref_=tt_ov_wr,6.6,"$500,000","$6,804,764","Rated PG for thematic material and some peril",0.0000
tt1129442,"Transporter 3","5 December 2008 ","1h 44min",/name/nm0576298?ref_=tt_ov_dr,/company/co0048273?ref_=cons_tt_dt_co_1,/name/nm0000108?ref_=tt_ov_wr,6.1,"$30,000,000","$12,063,452","Rated PG-13 for sequences of intense action and violence, some sexual content and drug material",0.0000
tt1130884,"Shutter Island","4 June 2010 ","2h 18min",/name/nm0000217?ref_=tt_ov_dr,/company/co0023400?ref_=cons_tt_dt_co_1,/name/nm0436164?ref_=tt_ov_wr,8.1,"$80,000,000","$41,062,440","Rated R for disturbing violent content, language and some nudity",0.0000
tt1132626,"Saw V","24 October 2008 ","1h 32min",/name/nm0352524?ref_=tt_ov_dr,/company/co0137447?ref_=cons_tt_dt_co_1,/name/nm1733317?ref_=tt_ov_wr,5.8,"$10,800,000","$30,053,954","Rated R for sequences of grisly bloody violence and torture, language and brief nudity",0.0000
tt1133985,"Green Lantern","17 June 2011 ","1h 54min",/name/nm0132709?ref_=tt_ov_dr,/company/co0026840?ref_=cons_tt_dt_co_1,/name/nm0075528?ref_=tt_ov_wr,5.6,"$200,000,000","$53,174,303","Rated PG-13 for intense sequences of sci-fi violence and action",0.0000
tt1136608,"District 9","11 September 2009 ","1h 52min",/name/nm0088955?ref_=tt_ov_dr,/company/co0005883?ref_=cons_tt_dt_co_1,/name/nm0088955?ref_=tt_ov_wr,8.0,"$30,000,000","$37,354,308",A,0.0000
tt1142798,"The Family That Preys","12 September 2008 ","1h 51min",/name/nm1347153?ref_=tt_ov_dr,/company/co0276208?ref_=cons_tt_dt_co_1,/name/nm1347153?ref_=tt_ov_wr,5.4,"$17,381,218,","$37,019,849","Rated PG-13 for thematic material, sexual references and brief violence",0.0000
tt1142800,"Madea Goes to Jail","20 February 2009 ","1h 43min",/name/nm1347153?ref_=tt_ov_dr,/company/co0142451?ref_=cons_tt_dt_co_1,/name/nm1347153?ref_=tt_ov_wr,4.3,"$41,030,947,","$90,485,233","Rated PG-13 for mature thematic material, drug content, some violence and sexual situations",0.0000
tt1142977,Frankenweenie,"5 October 2012 ","1h 27min",/name/nm0000318?ref_=tt_ov_dr,/company/co0008970?ref_=cons_tt_dt_co_1,/name/nm0728125?ref_=tt_ov_wr,7.0,"$39,000,000","$11,412,213","Rated PG for thematic elements, scary images and action",0.0000
tt1142988,"The Ugly Truth","24 July 2009 ","1h 36min",/name/nm0525659?ref_=tt_ov_dr,/company/co0071509?ref_=cons_tt_dt_co_1,/name/nm2946831?ref_=tt_ov_wr,6.5,"$38,000,000","$27,605,576","Rated R for sexual content and language",0.0000
tt1144884,"The Final Destination","28 August 2009 ","1h 22min",/name/nm0254786?ref_=tt_ov_dr,/company/co0046718?ref_=cons_tt_dt_co_1,/name/nm0107774?ref_=tt_ov_wr,5.2,"$40,000,000","$27,408,309","Rated R for strong violent/gruesome accidents, language and a scene of sexuality",0.0000
tt1152836,"Public Enemies","7 August 2009 ","2h 20min",/name/nm0000520?ref_=tt_ov_dr,/company/co0005073?ref_=cons_tt_dt_co_1,/name/nm0072032?ref_=tt_ov_wr,7.0,"$100,000,000","$25,271,675",A,0.0000
tt1155056,"I Love You, Man","20 March 2009 ","1h 45min",/name/nm0357453?ref_=tt_ov_dr,/company/co0040938?ref_=cons_tt_dt_co_1,/name/nm0357453?ref_=tt_ov_wr,7.0,"$40,000,000","$17,810,270","Rated R for pervasive language, including crude and sexual references",0.0000
tt1156398,Zombieland,"19 February 2010 ","1h 28min",/name/nm0281508?ref_=tt_ov_dr,/company/co0071509?ref_=cons_tt_dt_co_1,/name/nm1014201?ref_=tt_ov_wr,7.7,"$23,600,000","$24,733,155","Rated R for horror violence/gore and language",0.0000
tt1170358,"The Hobbit: The Desolation of Smaug","13 December 2013 ","2h 41min",/name/nm0001392?ref_=tt_ov_dr,/company/co0016037?ref_=cons_tt_dt_co_1,/name/nm0909638?ref_=tt_ov_wr,7.9,"$225,000,000","$73,645,197",UA,0.0000
tt1178665,"A Walk in the Woods","2 September 2015 ","1h 44min",/name/nm0477129?ref_=tt_ov_dr,/company/co0316867?ref_=cons_tt_dt_co_1,/name/nm1578335?ref_=tt_ov_wr,6.3,"$8,000,000","$8,400,000","Rated R for language and some sexual references",0.0000
tt1179904,"Paranormal Activity","8 January 2010 ","1h 26min",/name/nm2305431?ref_=tt_ov_dr,/company/co0336921?ref_=cons_tt_dt_co_1,/name/nm2305431?ref_=tt_ov_wr,6.3,"$15,000","$77,873","Rated R for language",0.0000
tt1185416,"When in Rome","29 January 2010 ","1h 31min",/name/nm0425756?ref_=tt_ov_dr,/company/co0049348?ref_=cons_tt_dt_co_1,/name/nm0224606?ref_=tt_ov_wr,5.6,"$55,000,000","$12,350,041","Rated PG-13 for some suggestive content",0.0000
tt1189340,"The Lincoln Lawyer","18 March 2011 ","1h 58min",/name/nm1026778?ref_=tt_ov_dr,/company/co0173285?ref_=cons_tt_dt_co_1,/name/nm0738908?ref_=tt_ov_wr,7.3,"$40,000,000","$13,206,453","Rated R for some violence, sexual content and language",0.0000
tt1190080,2012,"12 November 2009 ","2h 38min",/name/nm0000386?ref_=tt_ov_dr,/company/co0071509?ref_=cons_tt_dt_co_1,/name/nm0000386?ref_=tt_ov_wr,5.8,"$200,000,000","$65,237,614","Rated PG-13 for intense disaster sequences and some language",0.0000
tt1192628,Rango,"20 April 2011 ","1h 47min",/name/nm0893659?ref_=tt_ov_dr,/company/co0023400?ref_=cons_tt_dt_co_1,/name/nm0517589?ref_=tt_ov_wr,7.2,"$135,000,000","$38,079,323","Rated PG for rude humor, language, action and smoking",0.0000
tt1193138,"Up in the Air","19 February 2010 ","1h 49min",/name/nm0718646?ref_=tt_ov_dr,/company/co0023400?ref_=cons_tt_dt_co_1,/name/nm1174529?ref_=tt_ov_wr,7.4,"$25,000,000","$1,181,450","Rated R for language and some sexual content",0.0000
tt1193631,"Step Up 3D","3 September 2010 ","1h 47min",/name/nm0160840?ref_=tt_ov_dr,/company/co0046206?ref_=cons_tt_dt_co_1,/name/nm3655562?ref_=tt_ov_wr,6.2,"$30,000,000","$15,812,311","Rated PG-13 for brief strong language",0.0000
tt1195478,"The Five-Year Engagement","27 April 2012 ","2h 4min",/name/nm0831557?ref_=tt_ov_dr,/company/co0005073?ref_=cons_tt_dt_co_1,/name/nm0781981?ref_=tt_ov_wr,6.2,"$30,000,000","$10,610,060","Rated R for sexual content, and language throughout",0.0000
tt1196141,"Diary of a Wimpy Kid","19 March 2010 ","1h 34min",/name/nm0294457?ref_=tt_ov_dr,/company/co0212151?ref_=cons_tt_dt_co_1,/name/nm0066851?ref_=tt_ov_wr,6.2,"$15,000,000","$22,126,166","Rated PG for some rude humor and language",0.0000
tt1197624,"Law Abiding Citizen","16 October 2009 ","1h 49min",/name/nm0336620?ref_=tt_ov_dr,/company/co0187451?ref_=cons_tt_dt_co_1,/name/nm0934483?ref_=tt_ov_wr,7.4,"$50,000,000","$21,039,502","Rated R for strong bloody brutal violence and torture, a scene of rape, and pervasive language",0.0000
tt1201607,"Harry Potter and the Deathly Hallows: Part 2","15 July 2011 ","2h 10min",/name/nm0946734?ref_=tt_ov_dr,/company/co0026840?ref_=cons_tt_dt_co_1,/name/nm0460141?ref_=tt_ov_wr,8.1,"$125,000,000","$169,189,427","Rated PG-13 for some sequences of intense action violence and frightening images",0.0000
tt1204975,"Last Vegas","22 November 2013 ","1h 45min",/name/nm0005509?ref_=tt_ov_dr,/company/co0047306?ref_=cons_tt_dt_co_1,/name/nm1557594?ref_=tt_ov_wr,6.6,"$28,000,000","$16,334,566",A,0.0000
tt1204977,Ouija,"30 October 2014 ","1h 29min",/name/nm0925482?ref_=tt_ov_dr,/company/co0005073?ref_=cons_tt_dt_co_1,/name/nm1340000?ref_=tt_ov_wr,4.5,"$5,000,000","$19,900,000",A,0.0000
tt1205537,"Jack Ryan: Shadow Recruit","17 January 2014 ","1h 45min",/name/nm0000110?ref_=tt_ov_dr,/company/co0023400?ref_=cons_tt_dt_co_1,/name/nm3092414?ref_=tt_ov_wr,6.2,"$60,000,000","$17,200,000",UA,0.0000
tt1210166,Moneyball,"24 February 2012 ","2h 13min",/name/nm0587955?ref_=tt_ov_dr,/company/co0071509?ref_=cons_tt_dt_co_1,/name/nm0001873?ref_=tt_ov_wr,7.6,"$50,000,000","$19,501,302","Rated PG-13 for some strong language",0.0000
tt1210819,"The Lone Ranger","5 July 2013 ","2h 30min",/name/nm0893659?ref_=tt_ov_dr,/company/co0008970?ref_=cons_tt_dt_co_1,/name/nm1244808?ref_=tt_ov_wr,6.5,"$215,000,000","$29,210,849",UA,0.0000
tt1211837,"Doctor Strange","4 November 2016 ","1h 55min",/name/nm0220600?ref_=tt_ov_dr,/company/co0051941?ref_=cons_tt_dt_co_1,/name/nm3123612?ref_=tt_ov_wr,7.5,"$165,000,000","$85,058,311","Rated PG-13 for sci-fi violence and action throughout, and an intense crash sequence",0.0000
tt1212436,"The Back-up Plan","14 May 2010 ","1h 44min",/name/nm0693561?ref_=tt_ov_dr,/company/co0047306?ref_=cons_tt_dt_co_1,/name/nm1180074?ref_=tt_ov_wr,5.3,"$35,000,000","$12,201,710","Rated PG-13 for sexual content including references, some crude material and language",0.0000
tt1212450,Lawless,"29 August 2012 ","1h 56min",/name/nm0384825?ref_=tt_ov_dr,/company/co0150452?ref_=cons_tt_dt_co_1,/name/nm0147022?ref_=tt_ov_wr,7.3,"$26,000,000","$10,001,566","Rated R for strong bloody violence, language and some sexuality/nudity",0.0000
tt1216475,"Cars 2","24 June 2011 ","1h 46min",/name/nm0005124?ref_=tt_ov_dr,/company/co0008970?ref_=cons_tt_dt_co_1,/name/nm0005124?ref_=tt_ov_wr,6.2,"$200,000,000","$66,135,507",G,0.0000
tt1216492,"Leap Year","8 January 2010 ","1h 40min",/name/nm0875793?ref_=tt_ov_dr,/company/co0005073?ref_=cons_tt_dt_co_1,/name/nm0438226?ref_=tt_ov_wr,6.5,"$19,000,000","$9,202,815","Rated PG for sensuality and language",0.0000
tt1217209,Brave,"22 June 2012 ","1h 33min",/name/nm0028764?ref_=tt_ov_dr,/company/co0008970?ref_=cons_tt_dt_co_1,/name/nm0152312?ref_=tt_ov_wr,7.1,"$185,000,000","$66,323,594",U,0.0000
tt1217613,"Battle Los Angeles","11 March 2011 ","1h 56min",/name/nm0509448?ref_=tt_ov_dr,/company/co0071509?ref_=cons_tt_dt_co_1,/name/nm0078203?ref_=tt_ov_wr,5.8,"$70,000,000","$37,573,187","Rated PG-13 for sustained and intense sequences of war violence and destruction, and for language",0.0000
tt1219827,"Ghost in the Shell","7 April 2017 ","1h 47min",/name/nm2782185?ref_=tt_ov_dr,/company/co0023400?ref_=cons_tt_dt_co_1,/name/nm0794385?ref_=tt_ov_wr,6.4,"$110,000,000","$18,676,033","Rated PG-13 for intense sequences of sci-fi violence, suggestive content and some disturbing images",0.0000
tt1222817,Zookeeper,"23 September 2011 ","1h 42min",/name/nm0178997?ref_=tt_ov_dr,/company/co0071509?ref_=cons_tt_dt_co_1,/name/nm0048169?ref_=tt_ov_wr,5.2,"$80,000,000","$20,065,617",U,0.0000
tt1226229,"Get Him to the Greek","4 June 2010 ","1h 49min",/name/nm0831557?ref_=tt_ov_dr,/company/co0005073?ref_=cons_tt_dt_co_1,/name/nm0831557?ref_=tt_ov_wr,6.4,"$17,570,955,","$60,974,47","Rated R for strong sexual content and drug use throughout, and pervasive language",0.0000
tt1226273,"Edge of Darkness","29 January 2010 ","1h 57min",/name/nm0132709?ref_=tt_ov_dr,/company/co0026840?ref_=cons_tt_dt_co_1,/name/nm1184258?ref_=tt_ov_wr,6.6,"$80,000,000","$17,214,384","Rated R for strong bloody violence and language",0.0000
tt1226753,"The Debt","31 August 2011 ","1h 53min",/name/nm0006960?ref_=tt_ov_dr,/company/co0022594?ref_=cons_tt_dt_co_1,/name/nm0891216?ref_=tt_ov_wr,6.9,"$20,000,000","$9,949,109","Rated R for some violence and language",0.0000
tt1228705,"Iron Man 2","7 May 2010 ","2h 4min",/name/nm0269463?ref_=tt_ov_dr,/company/co0023400?ref_=cons_tt_dt_co_1,/name/nm0857620?ref_=tt_ov_wr,7.0,"$200,000,000","$128,122,480","Rated PG-13 for sequences of intense sci-fi action and violence, and some language",0.0000
tt1229238,"Mission: Impossible - Ghost Protocol","16 December 2011 ","2h 12min",/name/nm0083348?ref_=tt_ov_dr,/company/co0023400?ref_=cons_tt_dt_co_1,/name/nm0312367?ref_=tt_ov_wr,7.4,"$145,000,000","$12,785,204",UA,0.0000
